<?xml version="1.0" encoding="UTF-8"?>
<!DOCTYPE dataExchange SYSTEM "dtdForChase.dtd">
<dataExchange name="recipe">
	<source>
		<relation name="DEPT">
			<key name="did"/>
			<attribute name="dname"/>
			<attribute name="floor"/>
			<attribute name="manager"/>
			<attribute name="building"/>
		</relation>
	</source>
	<target>
		<relation name="DEPT">
			<key name="dname"/>
			<key name="floor"/>
			<key name="manager"/>
			<key name="building"/>
			<attribute name="did"/>
		</relation>
	</target>
</dataExchange>
